{
  "application_id": "APP-2026-000123",
  "created_at": "2026-08-17T09:00:00Z",
  "status": "ready_for_review",
  "applicant": {
    "name": "Ananya Rao",
    "declared_income": 65000,
    "loan_amount_requested": 500000,
    "loan_type": "personal"
  },

  "documents": [
    { "doc_id": "doc-01", "file_path": "uploads/doc-01.pdf", "type": "payslip", "classification_confidence": 0.98, "page_count": 1, "is_synthetic": true },
    { "doc_id": "doc-02", "file_path": "uploads/doc-02.pdf", "type": "bank_statement", "classification_confidence": 0.95, "page_count": 3, "is_synthetic": true },
    { "doc_id": "doc-03", "file_path": "uploads/doc-03.pdf", "type": "kyc_id", "classification_confidence": 0.99, "page_count": 1, "is_synthetic": true }
  ],

  "extracted_fields": [
    { "field_name": "employer_name", "value": "Bright Path Pvt Ltd", "confidence": 0.97, "source": { "doc_id": "doc-01", "page": 1, "bbox": [0.12, 0.20, 0.30, 0.03] }, "needs_review": false },
    { "field_name": "gross_monthly_income", "value": 65000, "confidence": 0.96, "source": { "doc_id": "doc-01", "page": 1, "bbox": [0.55, 0.40, 0.15, 0.03] }, "needs_review": false },
    { "field_name": "avg_monthly_deposit", "value": 61200, "confidence": 0.91, "source": { "doc_id": "doc-02", "page": 2 }, "needs_review": false },
    { "field_name": "applicant_name", "value": "Ananya Rao", "confidence": 0.99, "source": { "doc_id": "doc-03", "page": 1 }, "needs_review": false },
    { "field_name": "id_expiry_date", "value": "2029-04-01", "confidence": 0.62, "source": { "doc_id": "doc-03", "page": 1 }, "needs_review": true }
  ],

  "validation_findings": [
    {
      "finding_id": "vf-01",
      "severity": "info",
      "description": "Declared income and average bank deposits are within 6% of each other, consistent.",
      "related_fields": ["gross_monthly_income", "avg_monthly_deposit"],
      "doc_ids": ["doc-01", "doc-02"]
    }
  ],

  "missing_documents": [],

  "fraud_flags": [],

  "risk_score": {
    "approval_probability": 0.78,
    "model_version": "risk-xgb-v1",
    "factors": [
      { "feature": "income_to_loan_ratio", "contribution": 0.22 },
      { "feature": "deposit_consistency", "contribution": 0.11 },
      { "feature": "id_confidence_low", "contribution": -0.05 }
    ]
  },

  "compliance": {
    "bias_check_passed": true,
    "protected_attributes_excluded": ["gender", "religion", "caste", "age"],
    "notes": "Decision factors are all financial/document-based; no protected attributes used in scoring."
  },

  "summary_report": {
    "narrative": "Applicant Ananya Rao's income and bank deposit records are consistent. All required documents are present. One low-confidence field (ID expiry date) needs manual confirmation before approval.",
    "recommendation": "approve",
    "citations": [
      { "doc_id": "doc-01", "page": 1 },
      { "doc_id": "doc-02", "page": 2 }
    ]
  },

  "reviewer_decision": null,

  "audit_log": [
    { "agent": "classifier", "action": "classified 3 documents", "timestamp": "2026-08-17T09:00:05Z" },
    { "agent": "extraction", "action": "extracted 5 fields", "timestamp": "2026-08-17T09:00:12Z" },
    { "agent": "validation", "action": "ran cross-document checks", "timestamp": "2026-08-17T09:00:18Z" },
    { "agent": "risk_scoring", "action": "computed approval probability", "timestamp": "2026-08-17T09:00:22Z" },
    { "agent": "compliance", "action": "ran fairness check", "timestamp": "2026-08-17T09:00:24Z" },
    { "agent": "orchestrator", "action": "marked file ready_for_review", "timestamp": "2026-08-17T09:00:26Z" }
  ]
}
